{
  "manifestVersion": 1,
  "id": "org.decisionator.store.firestore",
  "name": "Firestore store (experimental, in-memory)",
  "version": "0.1.0",
  "description": "EXPERIMENTAL in-memory mock of a Firestore-backed store: data lives only in this tab and is lost on reload; there is no network sync and no server-side security (no firestore.rules). Password-protected projects are encrypted client-side. Not for real data.",
  "platform": {
    "runtime": "^1.0.0",
    "projectStore": "^1.2.0"
  },
  "main": "dist/index.js",
  "provides": {
    "projectStore": {
      "storeKind": "firestore",
      "supportsPassword": true,
      "supportsSharing": true,
      "supportsIndividualRemoval": true
    }
  },
  "permissions": []
}
