{
  "manifestVersion": 1,
  "id": "org.decisionator.strategy.random",
  "name": "Uniform random draw strategy",
  "version": "0.1.0",
  "platform": {
    "runtime": "^1.0.0"
  },
  "main": "dist/index.js",
  "provides": {
    "strategy": {
      "usesRandomness": true,
      "minOptions": 2,
      "requiresWeights": false,
      "ballots": "none"
    }
  }
}
